Name,Campsite,Address
YH,文山農場,新北市新店區湖子內路100號
YH,甜蜜點休閒莊園Sweet Spot Village,新北市淡水區奎柔山路189號
YH,頭目山水,新北市烏來區福山里3鄰卡拉模基21號
YH,拉拉山 微風山崚,桃園市復興區華陵里(搜尋微風山崚露營區)可到達
YH,比亞山露營區,桃園市復興區澤仁里3鄰37之12號
YH,達拉蓋,桃園市復興區霞雲里11鄰庫志35之15號(不要用導航，先下方圖一)
YH,拉拉山 塔曼之光露營區,桃園市復興區華陵里中心路315號(map:拉拉山塔曼之光露營區)
YH,拉拉山 雲河露營農場,桃園市復興區華陵里上巴陵中心路(導航可直接到達)
YH,拉拉山 長榮露營區,桃園市復興區華陵里中心路138-2號(恩愛農場下方處)
YH,拉拉山 夢想家園露營區,桃園市復興區華陵里9鄰巴崚85號
YH,拉拉山 遠見之星露營區,桃園市復興區中心路86巷28號
YH,拉拉山 木村的家露營區,桃園市復興區華陵里9鄰66-1號 (近鄉道116線)
YH,拉拉山 雅比斯露營區,桃園市復興區華陵里上巴陵9鄰69號
YH,拉拉山 比該溪生態露營區,桃園市復興區華陵里9鄰89-1號
YH,卡普休閒農莊,桃園市復興區義盛里5鄰23號
YH,八度野溪,桃園市復興區羅馬路三段238號
YH,八度野溪,桃園市復興區羅馬路三段238號
YH,美腿山親子露營區,桃園市復興區長興里11鄰75號
YH,石秀灣五葉松露營區,桃園市復興區羅馬路五段330號
YH,沒搞頭露營區,桃園市復興區霞雲里庫志35之20號(請先導到霞雲派出所，再以沿路的指示即可到達 )
YH,拉拉山 微笑草地,桃園市復興區華陵里11鄰中心路156-17號
YH,馬灣露營區,桃園市復興區霞雲里10鄰24號(map直接搜尋營區名稱，近省道台7線20.6K處左轉、產業道路2.1KM)
YH,拉拉山 天恩農場,桃園市復興區神木路193-2號(桃116線10km)
YH,貳柒珈琲露營區,桃園市復興區羅浮里7鄰高坡30-3號
YH,融奎霖休閒露營區,桃園市復興區霞雲里庫志9鄰13號
YH,泰雅秘境露營區,桃園市復興區奎輝里2鄰下奎輝2號
YH,可飛鹿營區,桃園縣復興區奎輝2鄰12號之3(118公路(羅馬公路)52.3km處)
YH,八度野溪,桃園市復興區羅馬路三段238號
YH,塔木休閒露營區,桃園市復興區10鄰29之5號
YH,馬莎度露營區,桃園市復興區霞雲里7鄰2-3號
YH,逍遙遊秘境露營區,桃園市復興區霞雲里5鄰佳志19-6號
YH,溫度露營區,桃園市復興區霞雲里庫志9鄰12號
YH,歡樂谷露營區,桃園市復興區霞雲里流霞路86號
YH,那山達雅賀,桃園市復興區霞雲里2鄰志繼9之6號
YH,水樂活親子農場,桃園市中壢區福達路二段628號
YH,好馨勤齊露營區,桃園市復興區澤仁里溪口台59-1號(近縣道118線57K處)
YH,福田美地,桃園市復興區霞雲里庫志11鄰24號
YH,達彥休閒露營區,桃園市復興區霞雲里庫志32號
YH,亞霧香草營區,桃園市復興區義盛里上宇內部落(南插天山傳統水管路登山口)
YH,谷力農場,桃園市復興區義盛里10鄰義興29號
YH,布納星空露營區,桃園市復興區義盛里5鄰卡普25之6號
YH,尤命築園露營區,新竹縣尖石鄉新樂村煤源8鄰41號
YH,挪亞星舟露營農莊,新竹縣新埔鎮鹿鳴里4鄰黃梨園28-15號(map直接搜尋名稱即可)
YH,空軍一號,新竹縣五峰鄉花園村天湖219-17號
YH,雷沙達岜斯,新竹縣尖石鄉義興村6鄰馬胎4號
YH,綠宥子甜柿果園露營區,新竹縣尖石鄉新樂村煤源10鄰65-3號
YH,輪園秘境,新竹縣五峰鄉花園村天湖219-1號
YH,大象露營地,新竹縣關西鎮仁安里拱子溝九鄰26號
YH,蘇珊藏美露營農場,新竹縣五峰鄉桃山村清泉17鄰296-28號
YH,高台山露營區,新竹縣尖石鄉錦屏村7鄰那羅26號(Google map搜尋營區名字即可抵達)
YH,小尖石露營區,新竹縣尖石鄉新樂村拉號部落(120縣道35k處右轉產業道路約600公尺)
YH,梅花天湖農園,新竹縣尖石鄉梅花村8鄰227號
YH,梅花山莊,新竹縣尖石鄉梅花村6鄰148號
YH,喜嵐田園露營區,新竹縣尖石鄉錦屏村那羅12鄰205之1號
YH,馬美欣欣營地,新竹縣尖石鄉玉峰村馬美8鄰29-1號
YH,楠桂坊露營區,新竹縣五峰鄉竹林村和平154-1號
YH,KT露營區,新竹縣五峰鄉花園村8鄰168-1號(竹59與62並不相通請留意)
YH,馬月台露營區,新竹縣尖石鄉義興村7鄰馬胎21-6號(竹59線終點就到)
YH,臻美營地,新竹縣尖石鄉新樂村煤源段8鄰36-2號 (竹120縣道40.5K處)(八五山大橋頭前右轉約700m)
YH,馬胎仙境,新竹縣尖石鄉義興村馬胎108-2號(馬胎部落)
YH,怡然自德,新竹縣尖石鄉梅花村8鄰(竹62線12.3K處)
YH,月伴灣露營區,新竹縣尖石鄉錦屏村10鄰那羅116-1號 (google map搜尋即可)
YH,熊麻吉親子露營區,新竹縣尖石鄉錦屏村那羅209號
YH,溪遊記露營區,導航至嘉興國小義興分校後關導航，再依路邊標示前來 (竹59過5.5K後繼續走300m，右邊岔路走到底)，如下圖
YH,印象尖石露營區,新竹縣尖石鄉新樂村煤源8鄰(竹120線36.6K處左轉)
YH,露營樂3號店,新竹縣尖石鄉新樂村(竹120縣道40.5K處)(先到臻美營地後依指示到達)
YH,愛上天湖,新竹縣五峰鄉花園村9鄰196-2號
YH,星院露營區,新竹縣北埔鄉大湖村下大湖10鄰
YH,景色天地露營區,從內灣老街導航至營區，沿途有指標(天湖方向道路封閉)
YH,尤瑪山莊,新竹縣五峰鄉大隘村23鄰471號
YH,玉峰 泰里埔露營區,新竹縣尖石鄉玉峰村3鄰24號(近鄉道60線19處)
YH,明園星空營地,"新埔鎮鹿鳴里黃梨園52-20號(請導航座標：24.856448,121.135753)"
YH,愛上天湖,新竹縣五峰鄉花園村9鄰196-2號 (Map搜尋愛上天湖，即可到達)
YH,觀雲露營區,新竹縣五峰鄉大隘村23鄰461-2號
YH,玉峰 遇見嵨繞,新竹縣尖石鄉玉峰村宇老1鄰9號(行駛竹60-1往玉峰方向)
YH,高台山,新竹縣尖石鄉錦屏村7鄰那羅26號(Google map搜尋營區名字即可抵達)
YH,玉峰 星光閃閃露營區,新竹縣尖石鄉玉峰村(地號:玉峰段682)-(行駛竹60-1往玉峰方向)
YH,臻美營地,新竹縣尖石鄉新樂村煤源段8鄰52之10號 (竹120縣道40.5K處)(八五山大橋頭前右轉約700m)
YH,司馬庫斯 達宴露營區,新竹縣尖石鄉(勿用地址導航)請參考訂位公告首頁下方圖片，沿路依指標上山。
YH,烏米的家露營區,新竹縣尖石鄉錦屏村9鄰那羅80-2號
YH,如果露營區,新竹縣尖石鄉嘉樂村7鄰嘉樂61號
YH,玉峰 光漫營地,新竹縣尖石鄉玉峰村12鄰抬耀22之10號(導航先到抬耀夢想書屋))再依指示標可到營地
YH,露營盒子,新竹縣峨眉鄉石井村(中豐公路89km處)；Google Map 89咖啡，直接導航即可。
YH,自然野趣,新竹縣尖石鄉新樂村六鄰水田150之3臨(導航到尖石新樂國小，再沿指示牌走)
YH,觀星賞月營地,新竹縣尖石鄉義興村馬胎部落168-5號(google map直接搜尋即可)
YH,梅后蔓露營區,新竹縣五峰鄉花園村8鄰花園185-11
YH,那羅的家親子露營區,新竹縣尖石鄉錦屏村12鄰那羅205之5號
YH,天湖秘境露營區,新竹縣五峰鄉花園村天湖196-9號
YH,野薑花露營區［全家超商野薑花店相關事業］,新竹縣尖石鄉錦屏村那羅一部落入口處（Google map搜尋「野薑花露營區」即可）
YH,樓蜜香菇農場,新竹縣尖石鄉那羅205之7號
YH,喜來登露營區,新竹縣五峰鄉大隘村4鄰51-11號(南清公路(竹122)往五峰方向35K處右轉沿路有指示牌可達營區)
YH,夢田,"新竹縣尖石鄉嘉樂村5鄰270-5號(120線道30k處左轉,約2k即到營區(沿路有指標)"
YH,漫步天湖,新竹縣五峰鄉花園村10鄰219之31號 (Google Map搜尋營區名字即可)
YH,遊橘露營區,新竹縣橫山鄉福興村八十分112之6
YH,馬瀨營地,新縣縣五峰鄉花園村天湖196-3
YH,馬胎仙境,新竹縣尖石鄉義興村馬胎108-2號(google map請搜尋馬胎仙境)
YH,歐莎露營區,新竹縣尖石鄉錦屏村2鄰比麟46-2號
YH,福興小農庄,新竹縣橫山鄉福興村八十分104號(可直接搜尋名稱)
YH,晴空森林露營區,新竹縣尖石鄉那羅村(近鄉道竹60線7.5公里處左轉煤源產業道路）
YH,梅花梯田免裝備露營區,新竹縣尖石鄉梅花村3鄰梅花79之3號
YH,參陳山內灣旅店營地,新竹縣尖石鄉義興村馬胎53號(此為民宿地址，民宿3分鐘車程即可到達營區)
YH,漫步天湖,新竹縣五峰鄉花園村10鄰219之31號 (Google Map搜尋營區名字即可)
YH,戀戀天湖,新竹縣五峰鄉花園村天湖219-15號
YH,自然野趣,新竹縣尖石鄉新樂村六鄰水田150之3臨(導航到尖石新樂國小，再沿指示牌走)
YH,馬胎227露營區,新竹縣尖石鄉義興村七鄰22-7號(馬胎部落)
YH,林泉休閒露營區,苗栗縣南庄鄉南江村17鄰福南30號
YH,清景農場,苗栗縣南庒鄉篷萊村紅毛館2鄰30號
YH,南庄慢生活露營區,苗栗縣南庄鄉田美村4鄰72-6號
YH,天藍露營區,苗栗縣大湖鄉武榮村4鄰23-10號(可於Google map搜尋天藍露營區)
YH,馬嘟溪露營基地,苗栗縣泰安鄉清安村洗水坑114-8號
YH,四季非露不可,苗栗縣大湖鄉武榮村坑美寮17之10號
YH,四季非露不可,苗栗縣大湖鄉武榮村坑美寮17之10號
YH,逸香園農場,苗栗縣卓蘭鎮坪林里坪林8鄰87號
YH,一片天,苗栗縣泰安鄉八卦村4鄰69-1號 (近泰安隧道)
YH,紅毛印象露營窩,苗栗市苗栗縣南庄鄉蓬萊村紅毛館五鄰66號
YH,UP露營區,苗栗縣泰安鄉清安村洗水坑苗62線4km(先到泰安分駐所，依指標前往)往右上迴轉1.2km處
YH,藍天嶺露營區,苗栗縣泰安鄉大興村5鄰45號
YH,景庭露營區,苗栗縣三義鄉双潭村崩山下16鄰88號 (往130線25.4K 聖衡宮恩主公的方向)
YH,春友彩虹民宿 餐廳 露營,苗栗縣南庄鄉東村南庄17鄰111號
YH,頤生園,苗栗縣卓蘭鎮坪林里坪林99-9號
YH,達喇改露營區,苗栗縣南庄鄉東河村24鄰鹿場部落內(直接google map可到達)
YH,南庄麒麟山露營區,苗栗縣南庄鄉南江村小東河11號(124縣道30.3K處轉入上山)
YH,南山傳奇,苗栗縣南庄鄉大湳連絡道路二(苗124線37.2公里處左轉往上約3公里到，沿途有清楚路標)
YH,溫馨休閒農場,苗栗縣三義鄉雙潭村16鄰崩山下38號
YH,一片天,苗栗縣泰安鄉八卦村4鄰69-1號(近泰安隧道)
YH,橄欖莊園,苗栗縣公館鄉(google map 搜尋 橄欖莊園 即可)
YH,長青露營區,苗栗縣南庄鄉南江村福南23鄰25-1號
YH,夢之谷露營區,Google Map搜尋夢之谷露營區，依沿路指標即可抵達；其他導航方式如下方圖示
YH,瑪都安露營區,苗栗縣泰安鄉清安村洗水坑118號(Google請直接搜尋瑪都安露營區)
YH,自由露營區,苗栗縣銅鑼鄉興隆村193號
YH,裕見生活,苗栗縣南庄鄉南江村3鄰東江38之12號
YH,杜石地一號,苗栗縣苗栗市新英里1鄰新英9之1號
YH,上長崎露營區,苗栗縣南庄鄉南江村長崎下18鄰13之3 (地圖導航：上長崎露營區或定位地圖座標)
YH,鄉町露營區,苗栗縣三灣鄉大銅鑼圈88號
YH,福人居露營區,苗栗縣大湖鄉大南勢32-1號
YH,南窩綠丘,苗栗縣通霄鎮5鄰城南66-5號(建議下通霄交流道後，再搜尋營區名字即可)
YH,寬闊露營區,苗栗縣泰安鄉梅園部落梅園段1171地號(map可搜尋營區名稱)
YH,向天湖露營區,苗栗縣南庄鄉東河村向天湖17鄰18號
YH,有鬼露營區,苗栗縣南庄鄉東河村鹿場部落24鄰13-5號
YH,南山傳奇,苗栗縣南庄鄉大湳連絡道路二(苗124線37.2公里處左轉往上約3公里到，沿途有清楚路標)
YH,朵悠露營區,Google Map輸入：朵悠露營區入口。入口處依營區指標向上，即可抵達。(如下方圖示)
YH,五福山莊,苗栗縣三義鄉龍騰村草排12鄰40號
YH,星樂親子露營,苗栗縣泰安鄉八卦村4鄰68號
YH,坐忘草堂露營區,苗栗縣銅鑼鄉盛隆村盛隆5鄰45-20號
YH,啊露吧Camping聖地,苗栗縣南庄鄉蓬萊村2鄰紅毛館35號
YH,黃金好望角露營區,苗栗縣後龍鎮福寧里頭湖6-2號旁(map直接搜尋營區名稱)
YH,石門客棧休閒農場露營區,苗栗縣大湖鄉栗林村竹橋20號
YH,吉娃斯景觀咖啡露營區,台中市和平區達觀里東崎路一段桃山巷1號
YH,德芙蘭農場,台中市和平區東關路一段359號
YH,天冷吹雲,台中市新社區福興里美林72-2號(可搜尋-天冷吹雲山莊，即可導航)
YH,摩天嶺楊園露營區,台中市和平區達觀里東崎路一段天嶺巷30之3號
YH,九甲林,台中市石岡區萬仙街岡仙巷7-1號
YH,九甲林,台中市石岡區萬仙街岡仙巷7-1號
YH,星空yay語露營區,台中市新社區永豐45-1號
YH,清境小瑞士花園,南投縣仁愛鄉定遠新村28號
YH,小野柳滑草場露營區,南投縣國姓鄉乾溝村中西巷6-2號(搜尋小野柳滑草場露營渡假村即可)
YH,牛母坪露營區,南投縣竹山鎮鯉魚里鯉行路134號 (導航請設：南投縣竹山鎮鯉魚里鯉行路152號)
YH,畫眉園露營區,南投縣仁愛鄉新生村山林巷10號
YH,點將家免裝備露營生態園區,投縣國姓鄉中寮鄉
YH,龍泉營地,南投縣埔里鎮武界路28之10號
YH,樂活森林,南投縣埔里鎮桃米路55-1號
YH,雙龍景觀露營區,南投縣信義鄉雙龍村光復巷9-2號
YH,樂活森林,南投縣埔里鎮桃米路55-1號
YH,成功秘境露營場,南投縣埔里鎮成功里種瓜路120-8號
YH,水中月民宿露營渡假村,南投縣國姓鄉北港村長北路117號-1號
YH,日月潭 九蛙秘境露營王國,南投縣魚池鄉中山路510巷9號
YH,地球村休閒農場,南投縣國姓鄉北港村長北路128號
YH,月夢田露營區,南投縣仁愛鄉新生村山林巷6-2號
YH,涵香小屋露營驛站,南投縣魚池鄉共和村五馬巷2之6號
YH,鶴里翁露營區,南投縣中寮鄉龍南路龍岩村151號之20
YH,桃米山生態休閒農業,南投縣埔里鎮種瓜路52-2號(可搜尋「埔里紅瓦厝山居民宿」)
YH,湯尼瑪麗露營區,南投縣埔里鎮種瓜路33之7號。Google Map：愛蘭交流道 。【勿走南村一巷，此路不通】詳洽下方路線圖
YH,露營樂6號店,南投縣中寮鄉復興巷31-12號
YH,依星生態農場,南投縣中寮鄉清水村頂坑巷1-1號(map搜尋:依星生態農場)
YH,1-2號營地,南投縣魚池鄉文武巷1-2號
YH,長壽天然農場,南投縣中寮鄉和興村永樂路(map直接搜尋營區名稱)
YH,溪泮別館,南投縣魚池鄉五馬巷2-6號
YH,ToMe 桃米生態露營區,南投縣埔里鎮桃米里種瓜路66-1號(map有定位點，務必從埔里愛蘭交流道下，往暨南大學的方向)
YH,言葉之庭,南投縣中寮鄉和興村永樂路134之2號
YH,三生園生態露營區,南投縣鹿谷鄉內湖村民生巷8-1號
YH,愛心露營地,南投縣魚池鄉新城村通文巷4-11號(map搜尋日月潭親子多肉DIY)
YH,暮雲春樹,南投縣埔里鎮桃米里10鄰種瓜路33之3號
YH,念念小憩,南投縣魚池鄉長寮段(google map搜尋念念小憩)
YH,魚宙露營區,南投縣魚池鄉福興巷20-16號(法林禪寺對面)
YH,深山林內生態農場,南投縣竹山鎮大鞍里頂林路累藤巷6-66號
YH,農家樂露營區,南投縣埔里鎮麒麟里武界路35-3號 ( Google Map 搜尋農家樂露營區 即可抵達)
YH,星願村露營區,南投縣仁愛鄉明月巷95之1附1號
YH,樹不老露營區,南投縣仁愛鄉新生村山林巷46-2號▲往惠蓀林場方向，皆有路標指引，部落風雨球場對面
YH,LOLO農場-休閒露營園區,南投縣埔里鎮眉原路1-4號
YH,空若水營地,南投縣魚池鄉東池村文武巷1-33號
YH,上野左岸生態露營區,南投縣國姓鄉(map搜尋營區名稱)即可
YH,溪泮小屋,南投縣魚池鄉五馬巷2-2號
YH,樸溯生活露營原區,南投縣仁愛鄉互助村清風路73號
YH,九九莊園休閒農場,雲林縣斗六市十三南路65-1號
YH,逸境生態露營區,雲林縣林內鄉自強路1巷23號
YH,十字關奢華在地露營區,雲林縣古坑鄉(google map直接搜尋十字關露營區)
YH,花田小露,嘉義縣番路鄉觸口村觸口村埔尾2號附9(google maps導航 花田小露露營區)
YH,鹿過好美露營區,嘉義縣阿里山鄉樂野村138號(依google導航鹿過好美宿營區)
YH,拉拉克斯莊園,嘉義縣阿里山鄉段40號(Google Map搜尋拉拉克斯莊園)
YH,草地狀元露營區,嘉義縣番路鄉大湖村2鄰17附1號 (近縣道159甲線26.5K處)
YH,淺山尋露,嘉義縣番路鄉公興村中寮3鄰5-10號(阿里山公路47.5公里處)
YH,天一露營區,嘉義縣竹崎鄉光華村11鄰茄苳仔29號
YH,岩仔腳,嘉義縣番路鄉民和村三鄰 岩仔腳16之6號
YH,達明休憩農場,嘉義縣阿里山鄉達邦村189-1號
YH,琢英露營場,嘉義縣梅山鄉太興村橫山6號
YH,羅老爸的家,嘉義縣阿里山鄉樂野村4鄰134號(可先導到隔避的倉伯露營區)
YH,星知心露營區,嘉義縣番路鄉公田村破布湖5號附8
YH,阿里山螢火蟲,嘉義縣竹崎鄉光華村一鄰9號(map搜尋阿里山螢火蟲露營區)
YH,阿里山 龍頂山,嘉義縣番路鄉公田村8鄰3號 (阿里山公路隙頂)
YH,岩仔腳,嘉義縣番路鄉民和村三鄰 岩仔腳16之6號
YH,倉伯露營區,嘉義縣阿里山鄉樂野村四鄰129-11號
YH,景山露營區,嘉義縣竹崎鄉光華村2鄰23號
YH,高美休閒營區,嘉義縣阿里山鄉樂野第一鄰16附3號 (阿里山公路63.8K)
YH,阿里山 龍頂山,嘉義縣番路鄉公田村8鄰3號 (阿里山公路隙頂)
YH,有夠遠露營區,嘉義縣阿里山鄉里佳村38號
YH,來灣哈露營區,嘉義縣阿里山郷樂野村4鄰125號-1號(台18線61K處右轉156線)
YH,禾田農莊,嘉義縣阿里山鄉樂野村2鄰82號(map直接搜尋營區名稱)
YH,受不寮露營區,嘉義縣阿里山鄉達邦村5鄰(先到鳥占亭步道，再依指標到達)
YH,好柿抵嘉農場,嘉義縣番路鄉埔尾52-3號
YH,仙腳趾景觀露營區,嘉義縣竹崎鄉白杞村樟樹坪41號之1
YH,晨光,嘉義縣阿里山鄉樂野村2鄰86號(map搜尋晨光露營區即可)
YH,瓜地亞那Gwaliana,嘉義縣阿里山鄉達邦橋村5鄰103號附8(達邦吊橋旁)
YH,天長地久露營區,嘉義縣番路鄉觸口村埔尾52-3號
YH,太和觀光果園露營區,嘉義縣梅山鄉太和村樟樹湖17號(縣道169線9.5k處)
YH,露營樂9號店,嘉義縣番路鄉大湖村(159甲26K處)map搜尋:阿里山草堂
YH,荒郊野外露營區,嘉義縣阿里山鄉(map搜尋營區名稱)即可
YH,鷺野之家,嘉義縣梅山鄉太興村溪頭10-2號
YH,星晴朗露營區,嘉義縣番路鄉觸口村埔尾42號附3
YH,塘湖古道露營農場,嘉義縣竹崎鄉福建坪12-2號
YH,露營樂1號店,台南市左鎮區光和65-5號(不要導航地址會找不到，map搜尋露營樂1號店即可)
YH,梅嶺露營區,台南市楠西區(google map搜尋神祕氣場即可到達)
YH,那次嵐露營區,高雄市那瑪夏區瑪雅里99號
YH,芳晨溫泉渡假村,高雄市六龜區寶來村中正路132號
YH,荖濃有機農場露營區,高雄市六龜區荖濃里裕濃路81巷18號
YH,雅悠露營區,高雄市那瑪夏區瑪雅里6鄰平和巷209-10號(可直接導航營區名稱)
YH,泗高露棧,高雄市六龜區和平路130-38號
YH,幸福城景觀露營區,宜蘭大同鄉泰雅路二段29巷58-6號(過茶之鄉民宿，往前約20公尺岔路處(台七線98.3公里處)往右走上山)
YH,天際線茶園營地,宜蘭縣大同鄉泰雅路(請使用google座標或地標導航)
YH,BulaBula.KC 布拉布拉露營區,宜蘭縣南澳鄉東岳村73巷3號 (東岳湧泉公園附近)
YH,淺山休閒露營區,宜蘭縣大同鄉寒溪村古魯巷1-17號
YH,武林秘密基地,宜蘭縣大同鄉寒溪村華興巷42號(鄰近寒溪吊橋)
YH,斯揚莫那休閒莊園,宜蘭縣大同鄉泰雅路六段8號(台7甲線15.2K處)
YH,哇吉散悠遊樂園露營區,宜蘭縣大同鄉復興村泰雅一路牛鬥巷81-1號
YH,星霧宿露營區,宜蘭縣大同鄉復興村泰雅一路牛鬥巷81-7號
YH,圓頂360,宜蘭縣大同鄉泰雅路一段88巷99號之19號
YH,天梯露營區,宜蘭縣大同鄉泰雅路一段88巷66號
YH,夏諾營露營區,宜蘭縣大同鄉松羅村泰雅路二段33巷31之7號
YH,雲端紅土咖啡露營區,宜蘭縣大同鄉崙埤村5鄰朝陽3-1號
YH,露營樂7號店,宜蘭縣大同鄉泰雅路一段88巷99號之19號
YH,宇世格爵露營區,宜蘭縣大同鄉樂水村碼崙路90巷16號(宜51線10K處)
YH,五葉松林休閒露營區,宜蘭縣大同鄉泰雅路二段33巷31之1號
YH,老柯野外探險營地,宜蘭縣南澳鄉金洋村博愛路18-1號
YH,太平山森活趣渡假農場,宜蘭縣大同鄉四季村泰雅路六段二巷6-3號(台七甲線13.7km處)
YH,山谷樂生態露營園區,宜蘭縣冬山鄉中山村中山路802號
YH,瀧雲山莊露營區,宜蘭縣南澳鄉武塔村橫山路13-7號
YH,哇芭來露營區,宜蘭縣大同鄉泰雅一路牛鬥巷69之15號
YH,秘密基地露營區,宜蘭縣大同鄉泰雅路二段88巷211-9號(導航請設定松羅國家步道)
YH,原最露營區,宜蘭縣大同鄉松羅村泰雅路二段46巷118之25
YH,幸福瑪崙露營區,宜蘭縣大同鄉樂水村樂水路20巷150-1號
YH,綠點集禾館,花蓮縣玉里鎮觀音里高寮223-3號(googlemap搜尋集禾小農)
YH,森林露營區,花蓮縣玉里鎮大禹里酸柑51號 （玉里高中斜對面）
YH,花蓮海洋露營區,花蓮縣壽豐鄉大橋30之6號
YH,悠悠太魯閣露營區,花蓮縣秀林鄉民治132-11號
YH,Ocean Chill 海憩露營區,花蓮縣新城鄉順安村北三棧 (臨近處: 7-11祥祐店-北三棧119之6號)
YH,初鹿椰子林,台東縣卑南鄉明峰村(入口為台9線345km處，進入後約300m可到)
YH,一零八零1080,google map直接搜尋 「一零八零1080」即可到達
